{"schema":"lockwood.cleanup-revalidation/v1","target_digest":"sha256:aaaaaaaaaaaaaaaaaaaaaaaaaaaaaaaaaaaaaaaaaaaaaaaaaaaaaaaaaaaaaaaa","cleanup_plan_digest":"sha256:bbbbbbbbbbbbbbbbbbbbbbbbbbbbbbbbbbbbbbbbbbbbbbbbbbbbbbbbbbbbbbbb","observed_digest":"sha256:aaaaaaaaaaaaaaaaaaaaaaaaaaaaaaaaaaaaaaaaaaaaaaaaaaaaaaaaaaaaaaaa","observed_size_bytes":10,"checked_at":"2026-09-17T12:30:00Z","reference_state":"clear","recovery_state":"clear","protection_state":"clear","state":"clear","blockers":[]}
